{
  "$schema": "https://json-schema.org/draft/2020-12/schema",
  "$id": "https://corvus.local/cards/schema.json",
  "title": "Corvus lesson card file",
  "description": "One file per lesson. Card ids are permanent: review history is keyed by them.",
  "type": "object",
  "required": ["language", "lesson", "unit", "title", "cards"],
  "additionalProperties": false,
  "properties": {
    "language": {
      "description": "BCP-47 code of the language being learned (e.g. 'la' for Latin).",
      "type": "string",
      "minLength": 2
    },
    "lesson": { "type": "integer", "minimum": 1 },
    "unit": { "type": "integer", "minimum": 1 },
    "title": { "type": "string", "minLength": 1 },
    "cards": {
      "type": "array",
      "minItems": 1,
      "items": { "$ref": "#/$defs/card" }
    }
  },
  "$defs": {
    "parseCell": {
      "description": "One cell of a grid: its row id and column id joined by '.', e.g. 'gen.sg'. Grids are defined in languages/<language>.json, and check-cards fails on a cell the grid doesn't have.",
      "type": "string",
      "pattern": "^[a-z0-9]+(\\.[a-z0-9]+)*$"
    },
    "card": {
      "type": "object",
      "required": ["id", "type", "prompt", "answer"],
      "additionalProperties": false,
      "properties": {
        "id": {
          "description": "Permanent unique id: lowercase letters, digits, hyphens. Convention: <language>-<lesson as 2 digits>-<slug>.",
          "type": "string",
          "pattern": "^[a-z0-9]+(-[a-z0-9]+)*$"
        },
        "type": { "enum": ["vocab", "concept", "ending", "parse", "phrase"] },
        "lemma": {
          "description": "The dictionary headword the card is about, lowercase with its marks (e.g. 'aqua', 'amō' for amat). Cards that share a lemma are siblings. It is also the answer of the reverse card.",
          "type": "string",
          "minLength": 1
        },
        "prompt": {
          "description": "What the learner sees. Markdown-lite: *italic* and **bold** only.",
          "type": "string",
          "minLength": 1
        },
        "answer": {
          "description": "The canonical answer. For parse cards, the list of every valid cell in the card's grid.",
          "oneOf": [
            { "type": "string", "minLength": 1 },
            {
              "type": "array",
              "minItems": 1,
              "uniqueItems": true,
              "items": { "$ref": "#/$defs/parseCell" }
            }
          ]
        },
        "accept": {
          "description": "Other answers that count as correct (typed modes).",
          "type": "array",
          "items": { "type": "string", "minLength": 1 }
        },
        "mode": {
          "description": "Override the type's default answer mode.",
          "enum": ["typed", "reveal", "grid"]
        },
        "grid": {
          "description": "parse only: the id of a grid in languages/<language>.json. Without it, the language's defaultGrid is used.",
          "type": "string",
          "pattern": "^[a-z0-9]+$"
        },
        "reverse": {
          "description": "vocab only: also generate a reverse card with id '<id>~r'. It shows this card's answer (and the hint) and expects the lemma, typed. Use true for a plain reverse card, or an object to add extras.",
          "oneOf": [
            { "const": true },
            {
              "type": "object",
              "additionalProperties": false,
              "properties": {
                "accept": {
                  "description": "Other target-language answers that count as correct.",
                  "type": "array",
                  "items": { "type": "string", "minLength": 1 }
                },
                "hint": {
                  "description": "Shown with the prompt to rule out a near-synonym, e.g. 'not animus'.",
                  "type": "string",
                  "minLength": 1
                },
                "retired": {
                  "description": "Hide the reverse card only; the forward card stays.",
                  "type": "boolean"
                }
              }
            }
          ]
        },
        "paradigm": {
          "description": "ending only: the id of the paradigm in languages/<language>.json that the form belongs to. Requires cell.",
          "type": "string",
          "pattern": "^[a-z0-9]+$"
        },
        "cell": {
          "description": "ending only: the form's cell in the paradigm's grid, e.g. 'gen.pl'. Requires paradigm.",
          "$ref": "#/$defs/parseCell"
        },
        "strictMarks": {
          "description": "Typed answers only: an answer that is right except for its marks is wrong, not a slip. For forms whose unmarked spelling is a different form the cards don't have yet (vēnit/venit).",
          "const": true
        },
        "hint": { "type": "string" },
        "notes": {
          "description": "Shown after answering: pronunciation, chemistry links, usage.",
          "type": "string"
        },
        "speak": {
          "description": "Text for the speak button if it differs from the target-language side.",
          "type": "string"
        },
        "tags": {
          "type": "array",
          "items": { "type": "string", "pattern": "^[a-z0-9-]+$" },
          "uniqueItems": true
        },
        "retired": {
          "description": "Hide from reviews without deleting history.",
          "type": "boolean"
        }
      },
      "allOf": [
        {
          "if": { "properties": { "type": { "const": "parse" } } },
          "then": { "properties": { "answer": { "type": "array" } } },
          "else": { "properties": { "answer": { "type": "string" } } }
        },
        {
          "if": { "required": ["reverse"] },
          "then": { "required": ["lemma"], "properties": { "type": { "const": "vocab" } } }
        },
        {
          "if": { "required": ["grid"] },
          "then": { "properties": { "type": { "const": "parse" } } }
        },
        {
          "if": { "anyOf": [{ "required": ["paradigm"] }, { "required": ["cell"] }] },
          "then": { "required": ["paradigm", "cell"], "properties": { "type": { "const": "ending" } } }
        },
        {
          "if": { "required": ["strictMarks"] },
          "then": { "not": { "properties": { "type": { "const": "parse" } } } }
        }
      ]
    }
  }
}
