{
  "language": "la",
  "lesson": 3,
  "unit": 1,
  "title": "The second declension: masculine -us and neuter -um",
  "cards": [
    {
      "id": "la-03-c-neuter-rule",
      "type": "concept",
      "prompt": "What is the neuter rule?",
      "answer": "Nominative and accusative are always identical, and in the plural both end in -a. True in every declension.",
      "tags": [
        "concept",
        "neuter"
      ]
    },
    {
      "id": "la-03-c-find-stem",
      "type": "concept",
      "prompt": "How do you find a noun's stem?",
      "answer": "Take the genitive singular from the dictionary entry and drop its ending: *ferrum, ferrī* → *ferr-*.",
      "notes": "That stem is what chemistry builds on: ferrous, ferric, ferrocene.",
      "tags": [
        "concept",
        "chemistry"
      ]
    },
    {
      "id": "la-03-v-dominus",
      "type": "vocab",
      "lemma": "dominus",
      "prompt": "dominus, dominī, m.",
      "answer": "lord",
      "reverse": true,
      "accept": [
        "master"
      ],
      "notes": "DOH-mee-noos.",
      "tags": [
        "vocab",
        "decl-2"
      ]
    },
    {
      "id": "la-03-v-servus",
      "type": "vocab",
      "lemma": "servus",
      "prompt": "servus, servī, m.",
      "answer": "servant",
      "accept": [
        "slave"
      ],
      "tags": [
        "vocab",
        "decl-2"
      ]
    },
    {
      "id": "la-03-v-agnus",
      "type": "vocab",
      "lemma": "agnus",
      "prompt": "agnus, agnī, m.",
      "answer": "lamb",
      "notes": "AH-nyoos: Ecclesiastical *gn* = \"ny\", as in canyon.",
      "tags": [
        "vocab",
        "decl-2"
      ]
    },
    {
      "id": "la-03-v-verbum",
      "type": "vocab",
      "lemma": "verbum",
      "prompt": "verbum, verbī, n.",
      "answer": "word",
      "tags": [
        "vocab",
        "decl-2"
      ]
    },
    {
      "id": "la-03-v-caelum",
      "type": "vocab",
      "lemma": "caelum",
      "prompt": "caelum, caelī, n. (pl. caelī, m.)",
      "answer": "heaven",
      "reverse": true,
      "accept": [
        "sky"
      ],
      "notes": "CHEH-loom: *c* before *ae* is \"ch\". Neuter in the singular, masculine in the plural: caelī, caelōrum, caelīs, caelōs. *Caelī ēnārrant glōriam Deī* (Ps 18:2).",
      "tags": [
        "vocab",
        "decl-2"
      ]
    },
    {
      "id": "la-03-v-amant",
      "type": "vocab",
      "lemma": "amō",
      "prompt": "amant",
      "answer": "they love",
      "accept": [
        "love"
      ],
      "notes": "Compare *amat*, he/she/it loves.",
      "tags": [
        "vocab"
      ]
    },
    {
      "id": "la-03-e-servus-gen-pl",
      "type": "ending",
      "lemma": "servus",
      "paradigm": "decl2m",
      "cell": "gen.pl",
      "prompt": "2nd decl. masc. · genitive plural of *servus*",
      "answer": "servōrum",
      "notes": "*Servus servōrum Deī*, \"servant of the servants of God\", a papal title.",
      "tags": [
        "ending",
        "decl-2"
      ]
    },
    {
      "id": "la-03-e-dominus-acc-pl",
      "type": "ending",
      "lemma": "dominus",
      "paradigm": "decl2m",
      "cell": "acc.pl",
      "prompt": "2nd decl. masc. · accusative plural of *dominus*",
      "answer": "dominōs",
      "tags": [
        "ending",
        "decl-2"
      ]
    },
    {
      "id": "la-03-x-caeli",
      "type": "parse",
      "lemma": "caelum",
      "prompt": "caelī",
      "answer": [
        "gen.sg",
        "nom.pl"
      ],
      "notes": "Neuter in the singular, masculine in the plural: caelī, caelōrum, caelīs, caelōs. *Caelī ēnārrant glōriam Deī* (Ps 18:2).",
      "tags": [
        "parse",
        "decl-2"
      ]
    },
    {
      "id": "la-03-h-hominem",
      "type": "ending",
      "lemma": "homō",
      "prompt": "*hominem*: dictionary headword?",
      "answer": "homō",
      "notes": "*homō, hominis, m.* The stem *homin-* comes from the genitive, so dropping -em does not give the headword.",
      "tags": [
        "headword"
      ]
    }
  ]
}