{
  "language": "la",
  "lesson": 1,
  "unit": 1,
  "title": "Endings vs word order; the accusative -m; element names",
  "cards": [
    {
      "id": "la-01-c-endings-vs-order",
      "type": "concept",
      "prompt": "In Latin, what tells you who does what to whom: word order or endings?",
      "answer": "Endings. Word order is flexible; the endings carry the grammar.",
      "notes": "*Deus hominem amat* = *Hominem Deus amat*.",
      "tags": [
        "concept"
      ]
    },
    {
      "id": "la-01-c-accusative-m",
      "type": "concept",
      "prompt": "What does the ending **-m** usually mark on a noun (as in *Deum*, *hominem*)?",
      "answer": "The direct object (accusative singular).",
      "notes": "Except neuters in -um (*ferrum*), where -m is also the nominative.",
      "tags": [
        "concept",
        "accusative"
      ]
    },
    {
      "id": "la-01-p-hominem-deus-amat",
      "type": "phrase",
      "prompt": "Hominem Deus amat.",
      "answer": "God loves the human being.",
      "notes": "*hominem* has the object ending -m, so it is loved, even though it comes first.",
      "tags": [
        "phrase"
      ]
    },
    {
      "id": "la-01-p-ora-et-labora",
      "type": "phrase",
      "prompt": "Ōrā et labōrā.",
      "answer": "Pray and work.",
      "notes": "Benedictine motto. OH-rah et lah-BOH-rah.",
      "tags": [
        "phrase"
      ]
    },
    {
      "id": "la-01-v-deus",
      "type": "vocab",
      "lemma": "deus",
      "prompt": "Deus, Deī, m.",
      "answer": "God",
      "reverse": true,
      "notes": "DEH-oos",
      "tags": [
        "vocab"
      ]
    },
    {
      "id": "la-01-v-homo",
      "type": "vocab",
      "lemma": "homō",
      "prompt": "homō, hominis, m.",
      "answer": "human being",
      "reverse": true,
      "accept": [
        "man",
        "person",
        "human"
      ],
      "notes": "3rd declension; you met the accusative *hominem*. Full pattern comes later.",
      "tags": [
        "vocab"
      ]
    },
    {
      "id": "la-01-v-amat",
      "type": "vocab",
      "lemma": "amō",
      "prompt": "amat",
      "answer": "he/she/it loves",
      "accept": [
        "loves",
        "he loves",
        "she loves",
        "it loves"
      ],
      "tags": [
        "vocab"
      ]
    },
    {
      "id": "la-01-v-et",
      "type": "vocab",
      "lemma": "et",
      "prompt": "et",
      "answer": "and",
      "tags": [
        "vocab"
      ]
    },
    {
      "id": "la-01-v-ora",
      "type": "vocab",
      "lemma": "ōrō",
      "prompt": "ōrā",
      "answer": "pray!",
      "accept": [
        "pray"
      ],
      "notes": "Command form (imperative) of *ōrāre*.",
      "tags": [
        "vocab"
      ]
    },
    {
      "id": "la-01-v-labora",
      "type": "vocab",
      "lemma": "labōrō",
      "prompt": "labōrā",
      "answer": "work!",
      "accept": [
        "work",
        "labor"
      ],
      "notes": "Command form of *labōrāre*; compare *laboratory*.",
      "tags": [
        "vocab"
      ]
    },
    {
      "id": "la-01-v-ferrum",
      "type": "vocab",
      "lemma": "ferrum",
      "prompt": "ferrum, ferrī, n.",
      "answer": "iron",
      "notes": "Fe. Stem *ferr-* → ferrous, ferric.",
      "tags": [
        "vocab",
        "element",
        "chemistry"
      ]
    },
    {
      "id": "la-01-v-aurum",
      "type": "vocab",
      "lemma": "aurum",
      "prompt": "aurum, aurī, n.",
      "answer": "gold",
      "notes": "Au. Stem *aur-* → auric.",
      "tags": [
        "vocab",
        "element",
        "chemistry"
      ]
    },
    {
      "id": "la-01-v-argentum",
      "type": "vocab",
      "lemma": "argentum",
      "prompt": "argentum, argentī, n.",
      "answer": "silver",
      "notes": "Ag. Also gave Argentina its name.",
      "tags": [
        "vocab",
        "element",
        "chemistry"
      ]
    },
    {
      "id": "la-01-v-plumbum",
      "type": "vocab",
      "lemma": "plumbum",
      "prompt": "plumbum, plumbī, n.",
      "answer": "lead",
      "notes": "Pb. Stem *plumb-* → plumber, plumb line.",
      "tags": [
        "vocab",
        "element",
        "chemistry"
      ]
    },
    {
      "id": "la-01-v-cuprum",
      "type": "vocab",
      "lemma": "cuprum",
      "prompt": "cuprum, cuprī, n.",
      "answer": "copper",
      "notes": "Cu. Stem *cupr-* → cuprous, cupric. Late Latin, from *Cyprium aes*, \"Cyprian metal\".",
      "tags": [
        "vocab",
        "element",
        "chemistry"
      ]
    }
  ]
}